"No.","Time","Source","Destination","Protocol","Length","Info"
"1","0.000000","127.0.0.1","127.0.0.1","Modbus/TCP","56","   Query: Trans:  7873; Unit:   1, Func:   6: Write Single Register"
"2","0.000041","127.0.0.1","127.0.0.1","TCP","44","502  >  1621 [ACK] Seq=1 Ack=13 Win=10105 Len=0"
"3","0.015166","127.0.0.1","127.0.0.1","Modbus/TCP","56","Response: Trans:  7873; Unit:   1, Func:   6: Write Single Register"
"4","0.015203","127.0.0.1","127.0.0.1","TCP","44","1621  >  502 [ACK] Seq=13 Ack=13 Win=10104 Len=0"
"5","0.015395","127.0.0.1","127.0.0.1","Modbus/TCP","56","   Query: Trans:  2861; Unit:   1, Func:   6: Write Single Register"
"6","0.015436","127.0.0.1","127.0.0.1","TCP","44","502  >  1621 [ACK] Seq=13 Ack=25 Win=10104 Len=0"
"7","0.046253","127.0.0.1","127.0.0.1","Modbus/TCP","56","Response: Trans:  2861; Unit:   1, Func:   6: Write Single Register"
"8","0.046305","127.0.0.1","127.0.0.1","TCP","44","1621  >  502 [ACK] Seq=25 Ack=25 Win=10104 Len=0"
"9","0.046498","127.0.0.1","127.0.0.1","Modbus/TCP","56","   Query: Trans: 36429; Unit:   1, Func:   6: Write Single Register"
"10","0.046537","127.0.0.1","127.0.0.1","TCP","44","502  >  1621 [ACK] Seq=25 Ack=37 Win=10104 Len=0"
"11","0.077415","127.0.0.1","127.0.0.1","Modbus/TCP","56","Response: Trans: 36429; Unit:   1, Func:   6: Write Single Register"
"12","0.077463","127.0.0.1","127.0.0.1","TCP","44","1621  >  502 [ACK] Seq=37 Ack=37 Win=10104 Len=0"
"13","0.077785","127.0.0.1","127.0.0.1","Modbus/TCP","56","   Query: Trans: 56364; Unit:   1, Func:   6: Write Single Register"
"14","0.077846","127.0.0.1","127.0.0.1","TCP","44","502  >  1621 [ACK] Seq=37 Ack=49 Win=10104 Len=0"
"15","0.108980","127.0.0.1","127.0.0.1","Modbus/TCP","56","Response: Trans: 56364; Unit:   1, Func:   6: Write Single Register"
"16","0.109032","127.0.0.1","127.0.0.1","TCP","44","1621  >  502 [ACK] Seq=49 Ack=49 Win=10104 Len=0"
"17","0.109167","127.0.0.1","127.0.0.1","Modbus/TCP","56","   Query: Trans:  8764; Unit:   1, Func:   6: Write Single Register"
"18","0.109206","127.0.0.1","127.0.0.1","TCP","44","502  >  1621 [ACK] Seq=49 Ack=61 Win=10104 Len=0"
"19","0.139956","127.0.0.1","127.0.0.1","Modbus/TCP","56","Response: Trans:  8764; Unit:   1, Func:   6: Write Single Register"
"20","0.140007","127.0.0.1","127.0.0.1","TCP","44","1621  >  502 [ACK] Seq=61 Ack=61 Win=10104 Len=0"
"21","0.140202","127.0.0.1","127.0.0.1","Modbus/TCP","56","   Query: Trans: 34962; Unit:   1, Func:   6: Write Single Register"
"22","0.140236","127.0.0.1","127.0.0.1","TCP","44","502  >  1621 [ACK] Seq=61 Ack=73 Win=10104 Len=0"
"23","0.171124","127.0.0.1","127.0.0.1","Modbus/TCP","56","Response: Trans: 34962; Unit:   1, Func:   6: Write Single Register"
"24","0.171175","127.0.0.1","127.0.0.1","TCP","44","1621  >  502 [ACK] Seq=73 Ack=73 Win=10104 Len=0"
"25","0.171372","127.0.0.1","127.0.0.1","Modbus/TCP","56","   Query: Trans: 63176; Unit:   1, Func:   6: Write Single Register"
"26","0.171417","127.0.0.1","127.0.0.1","TCP","44","502  >  1621 [ACK] Seq=73 Ack=85 Win=10104 Len=0"
"27","0.202367","127.0.0.1","127.0.0.1","Modbus/TCP","56","Response: Trans: 63176; Unit:   1, Func:   6: Write Single Register"
"28","0.202415","127.0.0.1","127.0.0.1","TCP","44","1621  >  502 [ACK] Seq=85 Ack=85 Win=10104 Len=0"
"29","0.202472","127.0.0.1","127.0.0.1","Modbus/TCP","56","   Query: Trans:  1408; Unit:   1, Func:   6: Write Single Register"
"30","0.202492","127.0.0.1","127.0.0.1","TCP","44","502  >  1621 [ACK] Seq=85 Ack=97 Win=10104 Len=0"
"31","0.233636","127.0.0.1","127.0.0.1","Modbus/TCP","56","Response: Trans:  1408; Unit:   1, Func:   6: Write Single Register"
"32","0.233684","127.0.0.1","127.0.0.1","TCP","44","1621  >  502 [ACK] Seq=97 Ack=97 Win=10104 Len=0"
"33","0.671170","127.0.0.1","127.0.0.1","Modbus/TCP","56","   Query: Trans:   462; Unit:   1, Func:   3: Read Holding Registers"
"34","0.671219","127.0.0.1","127.0.0.1","TCP","44","502  >  1615 [ACK] Seq=1 Ack=13 Win=10211 Len=0"
"35","0.686799","127.0.0.1","127.0.0.1","Modbus/TCP","93","Response: Trans:   462; Unit:   1, Func:   3: Read Holding Registers"
"36","0.686843","127.0.0.1","127.0.0.1","TCP","44","1615  >  502 [ACK] Seq=13 Ack=50 Win=10150 Len=0"
"37","0.734499","127.0.0.1","127.0.0.1","Modbus/TCP","56","   Query: Trans: 50719; Unit:   1, Func:   6: Write Single Register"
"38","0.734541","127.0.0.1","127.0.0.1","TCP","44","502  >  1621 [ACK] Seq=97 Ack=109 Win=10104 Len=0"
"39","0.749391","127.0.0.1","127.0.0.1","Modbus/TCP","56","Response: Trans: 50719; Unit:   1, Func:   6: Write Single Register"
"40","0.749439","127.0.0.1","127.0.0.1","TCP","44","1621  >  502 [ACK] Seq=109 Ack=109 Win=10104 Len=0"
"41","0.749609","127.0.0.1","127.0.0.1","Modbus/TCP","56","   Query: Trans: 62751; Unit:   1, Func:   6: Write Single Register"
"42","0.749629","127.0.0.1","127.0.0.1","TCP","44","502  >  1621 [ACK] Seq=109 Ack=121 Win=10104 Len=0"
"43","0.780652","127.0.0.1","127.0.0.1","Modbus/TCP","56","Response: Trans: 62751; Unit:   1, Func:   6: Write Single Register"
"44","0.780712","127.0.0.1","127.0.0.1","TCP","44","1621  >  502 [ACK] Seq=121 Ack=121 Win=10104 Len=0"
"45","0.780905","127.0.0.1","127.0.0.1","Modbus/TCP","56","   Query: Trans: 37331; Unit:   1, Func:   6: Write Single Register"
"46","0.780924","127.0.0.1","127.0.0.1","TCP","44","502  >  1621 [ACK] Seq=121 Ack=133 Win=10104 Len=0"
"47","0.812252","127.0.0.1","127.0.0.1","Modbus/TCP","56","Response: Trans: 37331; Unit:   1, Func:   6: Write Single Register"
"48","0.812353","127.0.0.1","127.0.0.1","TCP","44","1621  >  502 [ACK] Seq=133 Ack=133 Win=10104 Len=0"
"49","0.812812","127.0.0.1","127.0.0.1","Modbus/TCP","56","   Query: Trans: 53647; Unit:   1, Func:   6: Write Single Register"
"50","0.812905","127.0.0.1","127.0.0.1","TCP","44","502  >  1621 [ACK] Seq=133 Ack=145 Win=10104 Len=0"
"51","0.843082","127.0.0.1","127.0.0.1","Modbus/TCP","56","Response: Trans: 53647; Unit:   1, Func:   6: Write Single Register"
"52","0.843135","127.0.0.1","127.0.0.1","TCP","44","1621  >  502 [ACK] Seq=145 Ack=145 Win=10104 Len=0"
"53","0.843307","127.0.0.1","127.0.0.1","Modbus/TCP","56","   Query: Trans: 21912; Unit:   1, Func:   6: Write Single Register"
"54","0.843343","127.0.0.1","127.0.0.1","TCP","44","502  >  1621 [ACK] Seq=145 Ack=157 Win=10104 Len=0"
"55","0.874312","127.0.0.1","127.0.0.1","Modbus/TCP","56","Response: Trans: 21912; Unit:   1, Func:   6: Write Single Register"
"56","0.874347","127.0.0.1","127.0.0.1","TCP","44","1621  >  502 [ACK] Seq=157 Ack=157 Win=10104 Len=0"
"57","0.874492","127.0.0.1","127.0.0.1","Modbus/TCP","56","   Query: Trans: 13883; Unit:   1, Func:   6: Write Single Register"
"58","0.874511","127.0.0.1","127.0.0.1","TCP","44","502  >  1621 [ACK] Seq=157 Ack=169 Win=10104 Len=0"
"59","0.905557","127.0.0.1","127.0.0.1","Modbus/TCP","56","Response: Trans: 13883; Unit:   1, Func:   6: Write Single Register"
"60","0.905595","127.0.0.1","127.0.0.1","TCP","44","1621  >  502 [ACK] Seq=169 Ack=169 Win=10104 Len=0"
"61","0.905769","127.0.0.1","127.0.0.1","Modbus/TCP","56","   Query: Trans: 36518; Unit:   1, Func:   6: Write Single Register"
"62","0.905804","127.0.0.1","127.0.0.1","TCP","44","502  >  1621 [ACK] Seq=169 Ack=181 Win=10104 Len=0"
"63","0.936740","127.0.0.1","127.0.0.1","Modbus/TCP","56","Response: Trans: 36518; Unit:   1, Func:   6: Write Single Register"
"64","0.936783","127.0.0.1","127.0.0.1","TCP","44","1621  >  502 [ACK] Seq=181 Ack=181 Win=10104 Len=0"
"65","0.936880","127.0.0.1","127.0.0.1","Modbus/TCP","56","   Query: Trans: 23047; Unit:   1, Func:   6: Write Single Register"
"66","0.936909","127.0.0.1","127.0.0.1","TCP","44","502  >  1621 [ACK] Seq=181 Ack=193 Win=10104 Len=0"
"67","0.968340","127.0.0.1","127.0.0.1","Modbus/TCP","56","Response: Trans: 23047; Unit:   1, Func:   6: Write Single Register"
"68","0.968395","127.0.0.1","127.0.0.1","TCP","44","1621  >  502 [ACK] Seq=193 Ack=193 Win=10104 Len=0"
"69","1.484254","127.0.0.1","127.0.0.1","Modbus/TCP","56","   Query: Trans: 19026; Unit:   1, Func:   6: Write Single Register"
"70","1.484294","127.0.0.1","127.0.0.1","TCP","44","502  >  1621 [ACK] Seq=193 Ack=205 Win=10104 Len=0"
"71","1.499505","127.0.0.1","127.0.0.1","Modbus/TCP","56","Response: Trans: 19026; Unit:   1, Func:   6: Write Single Register"
"72","1.499551","127.0.0.1","127.0.0.1","TCP","44","1621  >  502 [ACK] Seq=205 Ack=205 Win=10104 Len=0"
"73","1.499828","127.0.0.1","127.0.0.1","Modbus/TCP","56","   Query: Trans: 33050; Unit:   1, Func:   6: Write Single Register"
"74","1.499869","127.0.0.1","127.0.0.1","TCP","44","502  >  1621 [ACK] Seq=205 Ack=217 Win=10104 Len=0"
"75","1.530845","127.0.0.1","127.0.0.1","Modbus/TCP","56","Response: Trans: 33050; Unit:   1, Func:   6: Write Single Register"
"76","1.530904","127.0.0.1","127.0.0.1","TCP","44","1621  >  502 [ACK] Seq=217 Ack=217 Win=10104 Len=0"
"77","1.531084","127.0.0.1","127.0.0.1","Modbus/TCP","56","   Query: Trans:  4405; Unit:   1, Func:   6: Write Single Register"
"78","1.531102","127.0.0.1","127.0.0.1","TCP","44","502  >  1621 [ACK] Seq=217 Ack=229 Win=10104 Len=0"
"79","1.561819","127.0.0.1","127.0.0.1","Modbus/TCP","56","Response: Trans:  4405; Unit:   1, Func:   6: Write Single Register"
"80","1.561869","127.0.0.1","127.0.0.1","TCP","44","1621  >  502 [ACK] Seq=229 Ack=229 Win=10104 Len=0"
"81","1.562084","127.0.0.1","127.0.0.1","Modbus/TCP","56","   Query: Trans:  9321; Unit:   1, Func:   6: Write Single Register"
"82","1.562118","127.0.0.1","127.0.0.1","TCP","44","502  >  1621 [ACK] Seq=229 Ack=241 Win=10104 Len=0"
"83","1.593067","127.0.0.1","127.0.0.1","Modbus/TCP","56","Response: Trans:  9321; Unit:   1, Func:   6: Write Single Register"
"84","1.593117","127.0.0.1","127.0.0.1","TCP","44","1621  >  502 [ACK] Seq=241 Ack=241 Win=10104 Len=0"
"85","1.593203","127.0.0.1","127.0.0.1","Modbus/TCP","56","   Query: Trans: 29851; Unit:   1, Func:   6: Write Single Register"
"86","1.593229","127.0.0.1","127.0.0.1","TCP","44","502  >  1621 [ACK] Seq=241 Ack=253 Win=10104 Len=0"
"87","1.624479","127.0.0.1","127.0.0.1","Modbus/TCP","56","Response: Trans: 29851; Unit:   1, Func:   6: Write Single Register"
"88","1.624535","127.0.0.1","127.0.0.1","TCP","44","1621  >  502 [ACK] Seq=253 Ack=253 Win=10104 Len=0"
"89","1.624659","127.0.0.1","127.0.0.1","Modbus/TCP","56","   Query: Trans: 49301; Unit:   1, Func:   6: Write Single Register"
"90","1.624688","127.0.0.1","127.0.0.1","TCP","44","502  >  1621 [ACK] Seq=253 Ack=265 Win=10104 Len=0"
"91","1.655606","127.0.0.1","127.0.0.1","Modbus/TCP","56","Response: Trans: 49301; Unit:   1, Func:   6: Write Single Register"
"92","1.655658","127.0.0.1","127.0.0.1","TCP","44","1621  >  502 [ACK] Seq=265 Ack=265 Win=10103 Len=0"
"93","1.655735","127.0.0.1","127.0.0.1","Modbus/TCP","56","   Query: Trans: 16706; Unit:   1, Func:   6: Write Single Register"
"94","1.655760","127.0.0.1","127.0.0.1","TCP","44","502  >  1621 [ACK] Seq=265 Ack=277 Win=10103 Len=0"
"95","1.686791","127.0.0.1","127.0.0.1","Modbus/TCP","56","Response: Trans: 16706; Unit:   1, Func:   6: Write Single Register"
"96","1.686842","127.0.0.1","127.0.0.1","TCP","44","1621  >  502 [ACK] Seq=277 Ack=277 Win=10103 Len=0"
"97","1.686902","127.0.0.1","127.0.0.1","Modbus/TCP","56","   Query: Trans: 62050; Unit:   1, Func:   6: Write Single Register"
"98","1.686923","127.0.0.1","127.0.0.1","TCP","44","502  >  1621 [ACK] Seq=277 Ack=289 Win=10103 Len=0"
"99","1.702373","127.0.0.1","127.0.0.1","Modbus/TCP","56","   Query: Trans:   463; Unit:   1, Func:   3: Read Holding Registers"
"100","1.702412","127.0.0.1","127.0.0.1","TCP","44","502  >  1615 [ACK] Seq=50 Ack=25 Win=10211 Len=0"
"101","1.717994","127.0.0.1","127.0.0.1","Modbus/TCP","56","Response: Trans: 62050; Unit:   1, Func:   6: Write Single Register"
"102","1.718034","127.0.0.1","127.0.0.1","TCP","44","1621  >  502 [ACK] Seq=289 Ack=289 Win=10103 Len=0"
"103","1.733817","127.0.0.1","127.0.0.1","Modbus/TCP","93","Response: Trans:   463; Unit:   1, Func:   3: Read Holding Registers"
"104","1.733848","127.0.0.1","127.0.0.1","TCP","44","1615  >  502 [ACK] Seq=25 Ack=99 Win=10150 Len=0"
"105","2.218670","127.0.0.1","127.0.0.1","Modbus/TCP","56","   Query: Trans:   816; Unit:   1, Func:   6: Write Single Register"
"106","2.218718","127.0.0.1","127.0.0.1","TCP","44","502  >  1621 [ACK] Seq=289 Ack=301 Win=10103 Len=0"
"107","2.233661","127.0.0.1","127.0.0.1","Modbus/TCP","56","Response: Trans:   816; Unit:   1, Func:   6: Write Single Register"
"108","2.233692","127.0.0.1","127.0.0.1","TCP","44","1621  >  502 [ACK] Seq=301 Ack=301 Win=10103 Len=0"
"109","2.233863","127.0.0.1","127.0.0.1","Modbus/TCP","56","   Query: Trans: 22907; Unit:   1, Func:   6: Write Single Register"
"110","2.233901","127.0.0.1","127.0.0.1","TCP","44","502  >  1621 [ACK] Seq=301 Ack=313 Win=10103 Len=0"
"111","2.264998","127.0.0.1","127.0.0.1","Modbus/TCP","56","Response: Trans: 22907; Unit:   1, Func:   6: Write Single Register"
"112","2.265050","127.0.0.1","127.0.0.1","TCP","44","1621  >  502 [ACK] Seq=313 Ack=313 Win=10103 Len=0"
"113","2.265227","127.0.0.1","127.0.0.1","Modbus/TCP","56","   Query: Trans: 11889; Unit:   1, Func:   6: Write Single Register"
"114","2.265246","127.0.0.1","127.0.0.1","TCP","44","502  >  1621 [ACK] Seq=313 Ack=325 Win=10103 Len=0"
"115","2.296226","127.0.0.1","127.0.0.1","Modbus/TCP","56","Response: Trans: 11889; Unit:   1, Func:   6: Write Single Register"
"116","2.296289","127.0.0.1","127.0.0.1","TCP","44","1621  >  502 [ACK] Seq=325 Ack=325 Win=10103 Len=0"
"117","2.296512","127.0.0.1","127.0.0.1","Modbus/TCP","56","   Query: Trans:  8223; Unit:   1, Func:   6: Write Single Register"
"118","2.296555","127.0.0.1","127.0.0.1","TCP","44","502  >  1621 [ACK] Seq=325 Ack=337 Win=10103 Len=0"
"119","2.327632","127.0.0.1","127.0.0.1","Modbus/TCP","56","Response: Trans:  8223; Unit:   1, Func:   6: Write Single Register"
"120","2.327676","127.0.0.1","127.0.0.1","TCP","44","1621  >  502 [ACK] Seq=337 Ack=337 Win=10103 Len=0"
"121","2.327872","127.0.0.1","127.0.0.1","Modbus/TCP","56","   Query: Trans: 38855; Unit:   1, Func:   6: Write Single Register"
"122","2.327905","127.0.0.1","127.0.0.1","TCP","44","502  >  1621 [ACK] Seq=337 Ack=349 Win=10103 Len=0"
"123","2.358678","127.0.0.1","127.0.0.1","Modbus/TCP","56","Response: Trans: 38855; Unit:   1, Func:   6: Write Single Register"
"124","2.358723","127.0.0.1","127.0.0.1","TCP","44","1621  >  502 [ACK] Seq=349 Ack=349 Win=10103 Len=0"
"125","2.358815","127.0.0.1","127.0.0.1","Modbus/TCP","56","   Query: Trans:  3574; Unit:   1, Func:   6: Write Single Register"
"126","2.358845","127.0.0.1","127.0.0.1","TCP","44","502  >  1621 [ACK] Seq=349 Ack=361 Win=10103 Len=0"
"127","2.389944","127.0.0.1","127.0.0.1","Modbus/TCP","56","Response: Trans:  3574; Unit:   1, Func:   6: Write Single Register"
"128","2.389995","127.0.0.1","127.0.0.1","TCP","44","1621  >  502 [ACK] Seq=361 Ack=361 Win=10103 Len=0"
"129","2.390139","127.0.0.1","127.0.0.1","Modbus/TCP","56","   Query: Trans: 35483; Unit:   1, Func:   6: Write Single Register"
"130","2.390171","127.0.0.1","127.0.0.1","TCP","44","502  >  1621 [ACK] Seq=361 Ack=373 Win=10103 Len=0"
"131","2.421375","127.0.0.1","127.0.0.1","Modbus/TCP","56","Response: Trans: 35483; Unit:   1, Func:   6: Write Single Register"
"132","2.421427","127.0.0.1","127.0.0.1","TCP","44","1621  >  502 [ACK] Seq=373 Ack=373 Win=10103 Len=0"
"133","2.421563","127.0.0.1","127.0.0.1","Modbus/TCP","56","   Query: Trans: 15990; Unit:   1, Func:   6: Write Single Register"
"134","2.421598","127.0.0.1","127.0.0.1","TCP","44","502  >  1621 [ACK] Seq=373 Ack=385 Win=10103 Len=0"
"135","2.452467","127.0.0.1","127.0.0.1","Modbus/TCP","56","Response: Trans: 15990; Unit:   1, Func:   6: Write Single Register"
"136","2.452522","127.0.0.1","127.0.0.1","TCP","44","1621  >  502 [ACK] Seq=385 Ack=385 Win=10103 Len=0"
"137","2.452580","127.0.0.1","127.0.0.1","Modbus/TCP","56","   Query: Trans: 10850; Unit:   1, Func:   6: Write Single Register"
"138","2.452602","127.0.0.1","127.0.0.1","TCP","44","502  >  1621 [ACK] Seq=385 Ack=397 Win=10103 Len=0"
"139","2.483699","127.0.0.1","127.0.0.1","Modbus/TCP","56","Response: Trans: 10850; Unit:   1, Func:   6: Write Single Register"
"140","2.483758","127.0.0.1","127.0.0.1","TCP","44","1621  >  502 [ACK] Seq=397 Ack=397 Win=10103 Len=0"
"141","2.483825","127.0.0.1","127.0.0.1","Modbus/TCP","56","   Query: Trans: 36022; Unit:   1, Func:   6: Write Single Register"
"142","2.483848","127.0.0.1","127.0.0.1","TCP","44","502  >  1621 [ACK] Seq=397 Ack=409 Win=10103 Len=0"
"143","2.514972","127.0.0.1","127.0.0.1","Modbus/TCP","56","Response: Trans: 36022; Unit:   1, Func:   6: Write Single Register"
"144","2.515022","127.0.0.1","127.0.0.1","TCP","44","1621  >  502 [ACK] Seq=409 Ack=409 Win=10103 Len=0"
"145","2.515128","127.0.0.1","127.0.0.1","Modbus/TCP","56","   Query: Trans:  9916; Unit:   1, Func:   6: Write Single Register"
"146","2.515153","127.0.0.1","127.0.0.1","TCP","44","502  >  1621 [ACK] Seq=409 Ack=421 Win=10103 Len=0"
"147","2.546198","127.0.0.1","127.0.0.1","Modbus/TCP","56","Response: Trans:  9916; Unit:   1, Func:   6: Write Single Register"
"148","2.546249","127.0.0.1","127.0.0.1","TCP","44","1621  >  502 [ACK] Seq=421 Ack=421 Win=10103 Len=0"
"149","2.546362","127.0.0.1","127.0.0.1","Modbus/TCP","56","   Query: Trans:  5652; Unit:   1, Func:   6: Write Single Register"
"150","2.546390","127.0.0.1","127.0.0.1","TCP","44","502  >  1621 [ACK] Seq=421 Ack=433 Win=10103 Len=0"
"151","2.577664","127.0.0.1","127.0.0.1","Modbus/TCP","56","Response: Trans:  5652; Unit:   1, Func:   6: Write Single Register"
"152","2.577717","127.0.0.1","127.0.0.1","TCP","44","1621  >  502 [ACK] Seq=433 Ack=433 Win=10103 Len=0"
"153","2.577854","127.0.0.1","127.0.0.1","Modbus/TCP","56","   Query: Trans: 40695; Unit:   1, Func:   6: Write Single Register"
"154","2.577889","127.0.0.1","127.0.0.1","TCP","44","502  >  1621 [ACK] Seq=433 Ack=445 Win=10103 Len=0"
"155","2.608687","127.0.0.1","127.0.0.1","Modbus/TCP","56","Response: Trans: 40695; Unit:   1, Func:   6: Write Single Register"
"156","2.608738","127.0.0.1","127.0.0.1","TCP","44","1621  >  502 [ACK] Seq=445 Ack=445 Win=10103 Len=0"
"157","2.608796","127.0.0.1","127.0.0.1","Modbus/TCP","56","   Query: Trans: 16940; Unit:   1, Func:   6: Write Single Register"
"158","2.608816","127.0.0.1","127.0.0.1","TCP","44","502  >  1621 [ACK] Seq=445 Ack=457 Win=10103 Len=0"
"159","2.639939","127.0.0.1","127.0.0.1","Modbus/TCP","56","Response: Trans: 16940; Unit:   1, Func:   6: Write Single Register"
"160","2.639991","127.0.0.1","127.0.0.1","TCP","44","1621  >  502 [ACK] Seq=457 Ack=457 Win=10103 Len=0"
"161","2.640077","127.0.0.1","127.0.0.1","Modbus/TCP","56","   Query: Trans: 45308; Unit:   1, Func:   6: Write Single Register"
"162","2.640111","127.0.0.1","127.0.0.1","TCP","44","502  >  1621 [ACK] Seq=457 Ack=469 Win=10103 Len=0"
"163","2.671424","127.0.0.1","127.0.0.1","Modbus/TCP","56","Response: Trans: 45308; Unit:   1, Func:   6: Write Single Register"
"164","2.671483","127.0.0.1","127.0.0.1","TCP","44","1621  >  502 [ACK] Seq=469 Ack=469 Win=10103 Len=0"
"165","2.702424","127.0.0.1","127.0.0.1","Modbus/TCP","56","   Query: Trans:   464; Unit:   1, Func:   3: Read Holding Registers"
"166","2.702465","127.0.0.1","127.0.0.1","TCP","44","502  >  1615 [ACK] Seq=99 Ack=37 Win=10211 Len=0"
"167","2.718205","127.0.0.1","127.0.0.1","Modbus/TCP","93","Response: Trans:   464; Unit:   1, Func:   3: Read Holding Registers"
"168","2.718257","127.0.0.1","127.0.0.1","TCP","44","1615  >  502 [ACK] Seq=37 Ack=148 Win=10150 Len=0"
"169","3.176177","127.0.0.1","127.0.0.1","Modbus/TCP","56","   Query: Trans: 22032; Unit:   1, Func:   6: Write Single Register"
"170","3.176217","127.0.0.1","127.0.0.1","TCP","44","502  >  1621 [ACK] Seq=469 Ack=481 Win=10103 Len=0"
"171","3.191360","127.0.0.1","127.0.0.1","Modbus/TCP","56","Response: Trans: 22032; Unit:   1, Func:   6: Write Single Register"
"172","3.191417","127.0.0.1","127.0.0.1","TCP","44","1621  >  502 [ACK] Seq=481 Ack=481 Win=10103 Len=0"
"173","3.191587","127.0.0.1","127.0.0.1","Modbus/TCP","56","   Query: Trans: 46075; Unit:   1, Func:   6: Write Single Register"
"174","3.191606","127.0.0.1","127.0.0.1","TCP","44","502  >  1621 [ACK] Seq=481 Ack=493 Win=10103 Len=0"
"175","3.222577","127.0.0.1","127.0.0.1","Modbus/TCP","56","Response: Trans: 46075; Unit:   1, Func:   6: Write Single Register"
"176","3.222642","127.0.0.1","127.0.0.1","TCP","44","1621  >  502 [ACK] Seq=493 Ack=493 Win=10103 Len=0"
"177","3.222850","127.0.0.1","127.0.0.1","Modbus/TCP","56","   Query: Trans: 60884; Unit:   1, Func:   6: Write Single Register"
"178","3.222893","127.0.0.1","127.0.0.1","TCP","44","502  >  1621 [ACK] Seq=493 Ack=505 Win=10103 Len=0"
"179","3.253756","127.0.0.1","127.0.0.1","Modbus/TCP","56","Response: Trans: 60884; Unit:   1, Func:   6: Write Single Register"
"180","3.253807","127.0.0.1","127.0.0.1","TCP","44","1621  >  502 [ACK] Seq=505 Ack=505 Win=10103 Len=0"
"181","3.254118","127.0.0.1","127.0.0.1","Modbus/TCP","56","   Query: Trans: 14537; Unit:   1, Func:   6: Write Single Register"
"182","3.254181","127.0.0.1","127.0.0.1","TCP","44","502  >  1621 [ACK] Seq=505 Ack=517 Win=10103 Len=0"
"183","3.285068","127.0.0.1","127.0.0.1","Modbus/TCP","56","Response: Trans: 14537; Unit:   1, Func:   6: Write Single Register"
"184","3.285122","127.0.0.1","127.0.0.1","TCP","44","1621  >  502 [ACK] Seq=517 Ack=517 Win=10103 Len=0"
"185","3.285252","127.0.0.1","127.0.0.1","Modbus/TCP","56","   Query: Trans: 48486; Unit:   1, Func:   6: Write Single Register"
"186","3.285272","127.0.0.1","127.0.0.1","TCP","44","502  >  1621 [ACK] Seq=517 Ack=529 Win=10103 Len=0"
"187","3.316191","127.0.0.1","127.0.0.1","Modbus/TCP","56","Response: Trans: 48486; Unit:   1, Func:   6: Write Single Register"
"188","3.316239","127.0.0.1","127.0.0.1","TCP","44","1621  >  502 [ACK] Seq=529 Ack=529 Win=10102 Len=0"
"189","3.316428","127.0.0.1","127.0.0.1","Modbus/TCP","56","   Query: Trans: 26632; Unit:   1, Func:   6: Write Single Register"
"190","3.316462","127.0.0.1","127.0.0.1","TCP","44","502  >  1621 [ACK] Seq=529 Ack=541 Win=10102 Len=0"
"191","3.347406","127.0.0.1","127.0.0.1","Modbus/TCP","56","Response: Trans: 26632; Unit:   1, Func:   6: Write Single Register"
"192","3.347444","127.0.0.1","127.0.0.1","TCP","44","1621  >  502 [ACK] Seq=541 Ack=541 Win=10102 Len=0"
"193","3.347614","127.0.0.1","127.0.0.1","Modbus/TCP","56","   Query: Trans: 48073; Unit:   1, Func:   6: Write Single Register"
"194","3.347633","127.0.0.1","127.0.0.1","TCP","44","502  >  1621 [ACK] Seq=541 Ack=553 Win=10102 Len=0"
"195","3.378693","127.0.0.1","127.0.0.1","Modbus/TCP","56","Response: Trans: 48073; Unit:   1, Func:   6: Write Single Register"
"196","3.378740","127.0.0.1","127.0.0.1","TCP","44","1621  >  502 [ACK] Seq=553 Ack=553 Win=10102 Len=0"
"197","3.378840","127.0.0.1","127.0.0.1","Modbus/TCP","56","   Query: Trans: 52183; Unit:   1, Func:   6: Write Single Register"
"198","3.378858","127.0.0.1","127.0.0.1","TCP","44","502  >  1621 [ACK] Seq=553 Ack=565 Win=10102 Len=0"
"199","3.409914","127.0.0.1","127.0.0.1","Modbus/TCP","56","Response: Trans: 52183; Unit:   1, Func:   6: Write Single Register"
"200","3.409967","127.0.0.1","127.0.0.1","TCP","44","1621  >  502 [ACK] Seq=565 Ack=565 Win=10102 Len=0"
"201","3.722517","127.0.0.1","127.0.0.1","Modbus/TCP","56","   Query: Trans:   465; Unit:   1, Func:   3: Read Holding Registers"
"202","3.722567","127.0.0.1","127.0.0.1","TCP","44","502  >  1615 [ACK] Seq=148 Ack=49 Win=10211 Len=0"
"203","3.738321","127.0.0.1","127.0.0.1","Modbus/TCP","93","Response: Trans:   465; Unit:   1, Func:   3: Read Holding Registers"
"204","3.738420","127.0.0.1","127.0.0.1","TCP","44","1615  >  502 [ACK] Seq=49 Ack=197 Win=10149 Len=0"
"205","3.910642","127.0.0.1","127.0.0.1","Modbus/TCP","56","   Query: Trans: 32196; Unit:   1, Func:   6: Write Single Register"
"206","3.910694","127.0.0.1","127.0.0.1","TCP","44","502  >  1621 [ACK] Seq=565 Ack=577 Win=10102 Len=0"
"207","3.926350","127.0.0.1","127.0.0.1","Modbus/TCP","56","Response: Trans: 32196; Unit:   1, Func:   6: Write Single Register"
"208","3.926425","127.0.0.1","127.0.0.1","TCP","44","1621  >  502 [ACK] Seq=577 Ack=577 Win=10102 Len=0"
"209","3.926636","127.0.0.1","127.0.0.1","Modbus/TCP","56","   Query: Trans: 65349; Unit:   1, Func:   6: Write Single Register"
"210","3.926658","127.0.0.1","127.0.0.1","TCP","44","502  >  1621 [ACK] Seq=577 Ack=589 Win=10102 Len=0"
"211","3.956957","127.0.0.1","127.0.0.1","Modbus/TCP","56","Response: Trans: 65349; Unit:   1, Func:   6: Write Single Register"
"212","3.957011","127.0.0.1","127.0.0.1","TCP","44","1621  >  502 [ACK] Seq=589 Ack=589 Win=10102 Len=0"
"213","3.957173","127.0.0.1","127.0.0.1","Modbus/TCP","56","   Query: Trans: 36229; Unit:   1, Func:   6: Write Single Register"
"214","3.957195","127.0.0.1","127.0.0.1","TCP","44","502  >  1621 [ACK] Seq=589 Ack=601 Win=10102 Len=0"
"215","3.988164","127.0.0.1","127.0.0.1","Modbus/TCP","56","Response: Trans: 36229; Unit:   1, Func:   6: Write Single Register"
"216","3.988222","127.0.0.1","127.0.0.1","TCP","44","1621  >  502 [ACK] Seq=601 Ack=601 Win=10102 Len=0"
"217","3.988451","127.0.0.1","127.0.0.1","Modbus/TCP","56","   Query: Trans: 58124; Unit:   1, Func:   6: Write Single Register"
"218","3.988476","127.0.0.1","127.0.0.1","TCP","44","502  >  1621 [ACK] Seq=601 Ack=613 Win=10102 Len=0"
"219","4.019371","127.0.0.1","127.0.0.1","Modbus/TCP","56","Response: Trans: 58124; Unit:   1, Func:   6: Write Single Register"
"220","4.019420","127.0.0.1","127.0.0.1","TCP","44","1621  >  502 [ACK] Seq=613 Ack=613 Win=10102 Len=0"
"221","4.019568","127.0.0.1","127.0.0.1","Modbus/TCP","56","   Query: Trans: 14196; Unit:   1, Func:   6: Write Single Register"
"222","4.019598","127.0.0.1","127.0.0.1","TCP","44","502  >  1621 [ACK] Seq=613 Ack=625 Win=10102 Len=0"
"223","4.050597","127.0.0.1","127.0.0.1","Modbus/TCP","56","Response: Trans: 14196; Unit:   1, Func:   6: Write Single Register"
"224","4.050627","127.0.0.1","127.0.0.1","TCP","44","1621  >  502 [ACK] Seq=625 Ack=625 Win=10102 Len=0"
"225","4.050831","127.0.0.1","127.0.0.1","Modbus/TCP","56","   Query: Trans: 45413; Unit:   1, Func:   6: Write Single Register"
"226","4.050862","127.0.0.1","127.0.0.1","TCP","44","502  >  1621 [ACK] Seq=625 Ack=637 Win=10102 Len=0"
"227","4.081862","127.0.0.1","127.0.0.1","Modbus/TCP","56","Response: Trans: 45413; Unit:   1, Func:   6: Write Single Register"
"228","4.081911","127.0.0.1","127.0.0.1","TCP","44","1621  >  502 [ACK] Seq=637 Ack=637 Win=10102 Len=0"
"229","4.082079","127.0.0.1","127.0.0.1","Modbus/TCP","56","   Query: Trans:   796; Unit:   1, Func:   6: Write Single Register"
"230","4.082111","127.0.0.1","127.0.0.1","TCP","44","502  >  1621 [ACK] Seq=637 Ack=649 Win=10102 Len=0"
"231","4.113139","127.0.0.1","127.0.0.1","Modbus/TCP","56","Response: Trans:   796; Unit:   1, Func:   6: Write Single Register"
"232","4.113191","127.0.0.1","127.0.0.1","TCP","44","1621  >  502 [ACK] Seq=649 Ack=649 Win=10102 Len=0"
"233","4.113361","127.0.0.1","127.0.0.1","Modbus/TCP","56","   Query: Trans: 49163; Unit:   1, Func:   6: Write Single Register"
"234","4.113380","127.0.0.1","127.0.0.1","TCP","44","502  >  1621 [ACK] Seq=649 Ack=661 Win=10102 Len=0"
"235","4.144383","127.0.0.1","127.0.0.1","Modbus/TCP","56","Response: Trans: 49163; Unit:   1, Func:   6: Write Single Register"
"236","4.144438","127.0.0.1","127.0.0.1","TCP","44","1621  >  502 [ACK] Seq=661 Ack=661 Win=10102 Len=0"
"237","4.660510","127.0.0.1","127.0.0.1","Modbus/TCP","56","   Query: Trans: 36515; Unit:   1, Func:   6: Write Single Register"
"238","4.660555","127.0.0.1","127.0.0.1","TCP","44","502  >  1621 [ACK] Seq=661 Ack=673 Win=10102 Len=0"
"239","4.675625","127.0.0.1","127.0.0.1","Modbus/TCP","56","Response: Trans: 36515; Unit:   1, Func:   6: Write Single Register"
"240","4.675683","127.0.0.1","127.0.0.1","TCP","44","1621  >  502 [ACK] Seq=673 Ack=673 Win=10102 Len=0"
"241","4.675798","127.0.0.1","127.0.0.1","Modbus/TCP","56","   Query: Trans: 49383; Unit:   1, Func:   6: Write Single Register"
"242","4.675827","127.0.0.1","127.0.0.1","TCP","44","502  >  1621 [ACK] Seq=673 Ack=685 Win=10102 Len=0"
"243","4.706992","127.0.0.1","127.0.0.1","Modbus/TCP","56","Response: Trans: 49383; Unit:   1, Func:   6: Write Single Register"
"244","4.707046","127.0.0.1","127.0.0.1","TCP","44","1621  >  502 [ACK] Seq=685 Ack=685 Win=10102 Len=0"
"245","4.707257","127.0.0.1","127.0.0.1","Modbus/TCP","56","   Query: Trans: 56835; Unit:   1, Func:   6: Write Single Register"
"246","4.707293","127.0.0.1","127.0.0.1","TCP","44","502  >  1621 [ACK] Seq=685 Ack=697 Win=10102 Len=0"
"247","4.738098","127.0.0.1","127.0.0.1","Modbus/TCP","56","Response: Trans: 56835; Unit:   1, Func:   6: Write Single Register"
"248","4.738143","127.0.0.1","127.0.0.1","TCP","44","1621  >  502 [ACK] Seq=697 Ack=697 Win=10102 Len=0"
"249","4.738354","127.0.0.1","127.0.0.1","Modbus/TCP","56","   Query: Trans: 39579; Unit:   1, Func:   6: Write Single Register"
"250","4.738386","127.0.0.1","127.0.0.1","TCP","44","502  >  1621 [ACK] Seq=697 Ack=709 Win=10102 Len=0"
"251","4.753685","127.0.0.1","127.0.0.1","Modbus/TCP","56","   Query: Trans:   466; Unit:   1, Func:   3: Read Holding Registers"
"252","4.753721","127.0.0.1","127.0.0.1","TCP","44","502  >  1615 [ACK] Seq=197 Ack=61 Win=10211 Len=0"
"253","4.769352","127.0.0.1","127.0.0.1","Modbus/TCP","56","Response: Trans: 39579; Unit:   1, Func:   6: Write Single Register"
"254","4.769399","127.0.0.1","127.0.0.1","TCP","44","1621  >  502 [ACK] Seq=709 Ack=709 Win=10102 Len=0"
"255","4.769466","127.0.0.1","127.0.0.1","Modbus/TCP","56","   Query: Trans: 49974; Unit:   1, Func:   6: Write Single Register"
"256","4.769487","127.0.0.1","127.0.0.1","TCP","44","502  >  1621 [ACK] Seq=709 Ack=721 Win=10102 Len=0"
"257","4.784913","127.0.0.1","127.0.0.1","Modbus/TCP","93","Response: Trans:   466; Unit:   1, Func:   3: Read Holding Registers"
"258","4.784955","127.0.0.1","127.0.0.1","TCP","44","1615  >  502 [ACK] Seq=61 Ack=246 Win=10149 Len=0"
"259","4.800590","127.0.0.1","127.0.0.1","Modbus/TCP","56","Response: Trans: 49974; Unit:   1, Func:   6: Write Single Register"
"260","4.800626","127.0.0.1","127.0.0.1","TCP","44","1621  >  502 [ACK] Seq=721 Ack=721 Win=10102 Len=0"
"261","4.800809","127.0.0.1","127.0.0.1","Modbus/TCP","56","   Query: Trans: 51958; Unit:   1, Func:   6: Write Single Register"
"262","4.800828","127.0.0.1","127.0.0.1","TCP","44","502  >  1621 [ACK] Seq=721 Ack=733 Win=10102 Len=0"
"263","4.831888","127.0.0.1","127.0.0.1","Modbus/TCP","56","Response: Trans: 51958; Unit:   1, Func:   6: Write Single Register"
"264","4.831935","127.0.0.1","127.0.0.1","TCP","44","1621  >  502 [ACK] Seq=733 Ack=733 Win=10102 Len=0"
"265","4.832139","127.0.0.1","127.0.0.1","Modbus/TCP","56","   Query: Trans: 45710; Unit:   1, Func:   6: Write Single Register"
"266","4.832180","127.0.0.1","127.0.0.1","TCP","44","502  >  1621 [ACK] Seq=733 Ack=745 Win=10102 Len=0"
"267","4.863107","127.0.0.1","127.0.0.1","Modbus/TCP","56","Response: Trans: 45710; Unit:   1, Func:   6: Write Single Register"
"268","4.863162","127.0.0.1","127.0.0.1","TCP","44","1621  >  502 [ACK] Seq=745 Ack=745 Win=10102 Len=0"
"269","4.863283","127.0.0.1","127.0.0.1","Modbus/TCP","56","   Query: Trans: 56719; Unit:   1, Func:   6: Write Single Register"
"270","4.863311","127.0.0.1","127.0.0.1","TCP","44","502  >  1621 [ACK] Seq=745 Ack=757 Win=10102 Len=0"
"271","4.894417","127.0.0.1","127.0.0.1","Modbus/TCP","56","Response: Trans: 56719; Unit:   1, Func:   6: Write Single Register"
"272","4.894472","127.0.0.1","127.0.0.1","TCP","44","1621  >  502 [ACK] Seq=757 Ack=757 Win=10102 Len=0"
"273","5.410542","127.0.0.1","127.0.0.1","Modbus/TCP","56","   Query: Trans: 32014; Unit:   1, Func:   6: Write Single Register"
"274","5.410583","127.0.0.1","127.0.0.1","TCP","44","502  >  1621 [ACK] Seq=757 Ack=769 Win=10102 Len=0"
"275","5.425677","127.0.0.1","127.0.0.1","Modbus/TCP","56","Response: Trans: 32014; Unit:   1, Func:   6: Write Single Register"
"276","5.425727","127.0.0.1","127.0.0.1","TCP","44","1621  >  502 [ACK] Seq=769 Ack=769 Win=10102 Len=0"
"277","5.425825","127.0.0.1","127.0.0.1","Modbus/TCP","56","   Query: Trans: 43059; Unit:   1, Func:   6: Write Single Register"
"278","5.425851","127.0.0.1","127.0.0.1","TCP","44","502  >  1621 [ACK] Seq=769 Ack=781 Win=10102 Len=0"
"279","5.456869","127.0.0.1","127.0.0.1","Modbus/TCP","56","Response: Trans: 43059; Unit:   1, Func:   6: Write Single Register"
"280","5.456922","127.0.0.1","127.0.0.1","TCP","44","1621  >  502 [ACK] Seq=781 Ack=781 Win=10101 Len=0"
"281","5.457134","127.0.0.1","127.0.0.1","Modbus/TCP","56","   Query: Trans: 49692; Unit:   1, Func:   6: Write Single Register"
"282","5.457173","127.0.0.1","127.0.0.1","TCP","44","502  >  1621 [ACK] Seq=781 Ack=793 Win=10101 Len=0"
"283","5.488096","127.0.0.1","127.0.0.1","Modbus/TCP","56","Response: Trans: 49692; Unit:   1, Func:   6: Write Single Register"
"284","5.488142","127.0.0.1","127.0.0.1","TCP","44","1621  >  502 [ACK] Seq=793 Ack=793 Win=10101 Len=0"
"285","5.488338","127.0.0.1","127.0.0.1","Modbus/TCP","56","   Query: Trans: 57469; Unit:   1, Func:   6: Write Single Register"
"286","5.488372","127.0.0.1","127.0.0.1","TCP","44","502  >  1621 [ACK] Seq=793 Ack=805 Win=10101 Len=0"
"287","5.519419","127.0.0.1","127.0.0.1","Modbus/TCP","56","Response: Trans: 57469; Unit:   1, Func:   6: Write Single Register"
"288","5.519474","127.0.0.1","127.0.0.1","TCP","44","1621  >  502 [ACK] Seq=805 Ack=805 Win=10101 Len=0"
"289","5.519625","127.0.0.1","127.0.0.1","Modbus/TCP","56","   Query: Trans: 35033; Unit:   1, Func:   6: Write Single Register"
"290","5.519655","127.0.0.1","127.0.0.1","TCP","44","502  >  1621 [ACK] Seq=805 Ack=817 Win=10101 Len=0"
"291","5.550633","127.0.0.1","127.0.0.1","Modbus/TCP","56","Response: Trans: 35033; Unit:   1, Func:   6: Write Single Register"
"292","5.550686","127.0.0.1","127.0.0.1","TCP","44","1621  >  502 [ACK] Seq=817 Ack=817 Win=10101 Len=0"
"293","5.550867","127.0.0.1","127.0.0.1","Modbus/TCP","56","   Query: Trans: 55109; Unit:   1, Func:   6: Write Single Register"
"294","5.550901","127.0.0.1","127.0.0.1","TCP","44","502  >  1621 [ACK] Seq=817 Ack=829 Win=10101 Len=0"
"295","5.581965","127.0.0.1","127.0.0.1","Modbus/TCP","56","Response: Trans: 55109; Unit:   1, Func:   6: Write Single Register"
"296","5.582024","127.0.0.1","127.0.0.1","TCP","44","1621  >  502 [ACK] Seq=829 Ack=829 Win=10101 Len=0"
"297","5.582201","127.0.0.1","127.0.0.1","Modbus/TCP","56","   Query: Trans: 29790; Unit:   1, Func:   6: Write Single Register"
"298","5.582238","127.0.0.1","127.0.0.1","TCP","44","502  >  1621 [ACK] Seq=829 Ack=841 Win=10101 Len=0"
"299","5.613390","127.0.0.1","127.0.0.1","Modbus/TCP","56","Response: Trans: 29790; Unit:   1, Func:   6: Write Single Register"
"300","5.613445","127.0.0.1","127.0.0.1","TCP","44","1621  >  502 [ACK] Seq=841 Ack=841 Win=10101 Len=0"
"301","5.613635","127.0.0.1","127.0.0.1","Modbus/TCP","56","   Query: Trans: 54615; Unit:   1, Func:   6: Write Single Register"
"302","5.613671","127.0.0.1","127.0.0.1","TCP","44","502  >  1621 [ACK] Seq=841 Ack=853 Win=10101 Len=0"
"303","5.644428","127.0.0.1","127.0.0.1","Modbus/TCP","56","Response: Trans: 54615; Unit:   1, Func:   6: Write Single Register"
"304","5.644491","127.0.0.1","127.0.0.1","TCP","44","1621  >  502 [ACK] Seq=853 Ack=853 Win=10101 Len=0"
"305","5.644692","127.0.0.1","127.0.0.1","Modbus/TCP","56","   Query: Trans: 57674; Unit:   1, Func:   6: Write Single Register"
"306","5.644727","127.0.0.1","127.0.0.1","TCP","44","502  >  1621 [ACK] Seq=853 Ack=865 Win=10101 Len=0"
"307","5.675651","127.0.0.1","127.0.0.1","Modbus/TCP","56","Response: Trans: 57674; Unit:   1, Func:   6: Write Single Register"
"308","5.675700","127.0.0.1","127.0.0.1","TCP","44","1621  >  502 [ACK] Seq=865 Ack=865 Win=10101 Len=0"
"309","5.675833","127.0.0.1","127.0.0.1","Modbus/TCP","56","   Query: Trans:  3179; Unit:   1, Func:   6: Write Single Register"
"310","5.675852","127.0.0.1","127.0.0.1","TCP","44","502  >  1621 [ACK] Seq=865 Ack=877 Win=10101 Len=0"
"311","5.706901","127.0.0.1","127.0.0.1","Modbus/TCP","56","Response: Trans:  3179; Unit:   1, Func:   6: Write Single Register"
"312","5.706955","127.0.0.1","127.0.0.1","TCP","44","1621  >  502 [ACK] Seq=877 Ack=877 Win=10101 Len=0"
"313","5.707118","127.0.0.1","127.0.0.1","Modbus/TCP","56","   Query: Trans: 21930; Unit:   1, Func:   6: Write Single Register"
"314","5.707138","127.0.0.1","127.0.0.1","TCP","44","502  >  1621 [ACK] Seq=877 Ack=889 Win=10101 Len=0"
"315","5.738167","127.0.0.1","127.0.0.1","Modbus/TCP","56","Response: Trans: 21930; Unit:   1, Func:   6: Write Single Register"
"316","5.738220","127.0.0.1","127.0.0.1","TCP","44","1621  >  502 [ACK] Seq=889 Ack=889 Win=10101 Len=0"
"317","5.738393","127.0.0.1","127.0.0.1","Modbus/TCP","56","   Query: Trans: 12278; Unit:   1, Func:   6: Write Single Register"
"318","5.738426","127.0.0.1","127.0.0.1","TCP","44","502  >  1621 [ACK] Seq=889 Ack=901 Win=10101 Len=0"
"319","5.753731","127.0.0.1","127.0.0.1","Modbus/TCP","56","   Query: Trans:   467; Unit:   1, Func:   3: Read Holding Registers"
"320","5.753764","127.0.0.1","127.0.0.1","TCP","44","502  >  1615 [ACK] Seq=246 Ack=73 Win=10211 Len=0"
"321","5.769423","127.0.0.1","127.0.0.1","Modbus/TCP","56","Response: Trans: 12278; Unit:   1, Func:   6: Write Single Register"
"322","5.769475","127.0.0.1","127.0.0.1","TCP","44","1621  >  502 [ACK] Seq=901 Ack=901 Win=10101 Len=0"
"323","5.769651","127.0.0.1","127.0.0.1","Modbus/TCP","56","   Query: Trans: 65474; Unit:   1, Func:   6: Write Single Register"
"324","5.769681","127.0.0.1","127.0.0.1","TCP","44","502  >  1621 [ACK] Seq=901 Ack=913 Win=10101 Len=0"
"325","5.785024","127.0.0.1","127.0.0.1","Modbus/TCP","93","Response: Trans:   467; Unit:   1, Func:   3: Read Holding Registers"
"326","5.785078","127.0.0.1","127.0.0.1","TCP","44","1615  >  502 [ACK] Seq=73 Ack=295 Win=10149 Len=0"
"327","5.800679","127.0.0.1","127.0.0.1","Modbus/TCP","56","Response: Trans: 65474; Unit:   1, Func:   6: Write Single Register"
"328","5.800727","127.0.0.1","127.0.0.1","TCP","44","1621  >  502 [ACK] Seq=913 Ack=913 Win=10101 Len=0"
"329","5.800919","127.0.0.1","127.0.0.1","Modbus/TCP","56","   Query: Trans:   462; Unit:   1, Func:   6: Write Single Register"
"330","5.800957","127.0.0.1","127.0.0.1","TCP","44","502  >  1621 [ACK] Seq=913 Ack=925 Win=10101 Len=0"
"331","5.831877","127.0.0.1","127.0.0.1","Modbus/TCP","56","Response: Trans:   462; Unit:   1, Func:   6: Write Single Register"
"332","5.831930","127.0.0.1","127.0.0.1","TCP","44","1621  >  502 [ACK] Seq=925 Ack=925 Win=10101 Len=0"
"333","5.832158","127.0.0.1","127.0.0.1","Modbus/TCP","56","   Query: Trans: 47929; Unit:   1, Func:   6: Write Single Register"
"334","5.832200","127.0.0.1","127.0.0.1","TCP","44","502  >  1621 [ACK] Seq=925 Ack=937 Win=10101 Len=0"
"335","5.863269","127.0.0.1","127.0.0.1","Modbus/TCP","56","Response: Trans: 47929; Unit:   1, Func:   6: Write Single Register"
"336","5.863324","127.0.0.1","127.0.0.1","TCP","44","1621  >  502 [ACK] Seq=937 Ack=937 Win=10101 Len=0"
"337","6.363646","127.0.0.1","127.0.0.1","Modbus/TCP","56","   Query: Trans: 25500; Unit:   1, Func:   6: Write Single Register"
"338","6.363691","127.0.0.1","127.0.0.1","TCP","44","502  >  1621 [ACK] Seq=937 Ack=949 Win=10101 Len=0"
"339","6.378825","127.0.0.1","127.0.0.1","Modbus/TCP","56","Response: Trans: 25500; Unit:   1, Func:   6: Write Single Register"
"340","6.378868","127.0.0.1","127.0.0.1","TCP","44","1621  >  502 [ACK] Seq=949 Ack=949 Win=10101 Len=0"
"341","6.379089","127.0.0.1","127.0.0.1","Modbus/TCP","56","   Query: Trans: 51244; Unit:   1, Func:   6: Write Single Register"
"342","6.379133","127.0.0.1","127.0.0.1","TCP","44","502  >  1621 [ACK] Seq=949 Ack=961 Win=10101 Len=0"
